{
 "lang": "german",
 "name": "German",
 "native": "Deutsch",
 "notes": {
  "variety": "Standard German as spoken in Germany, in the everyday spoken register the Goethe B1 exam expects: Perfekt for the past, du and Sie both shown, no dialect. Austrian and Swiss forms (Grüß Gott, Jänner) are mentioned only where a learner will hear them. Written-formal German appears in the B2 and C1 layers, because that is where a German speaker actually shifts into it.",
  "turns": "German has no progressive: ich gehe covers both 'I go' and 'I am going', with gerade or jetzt added when it matters. The spoken past is the Perfekt (ich bin gegangen), which also does the job of the English present perfect; the Präteritum (ich ging) is for writing, except that sein, haben and the modals are said in the Präteritum even in speech. The future is usually the present plus a time word (morgen fahre ich); werden + infinitive adds promise, prediction or emphasis. The Plusquamperfekt (ich war gegangen) exists and is used with nachdem and bevor. A perfect continuous does not exist: use the present plus seit (ich wohne seit 2020 hier). Conditional and reported speech use Konjunktiv II (würde, hätte, wäre, könnte) and, in writing, Konjunktiv I.",
  "wordOrder": "In a main clause the conjugated verb is always in second position, whatever comes first: Morgen fahre ich nach Berlin. Everything else that belongs to the verb (infinitive, participle, separable prefix) goes to the end, forming a bracket: Ich muss morgen früh aufstehen. Coordinating glue (und, aber, oder, denn) takes position zero and changes nothing; subordinating glue (weil, dass, wenn, obwohl) sends the conjugated verb to the end of its clause. A subordinate clause placed first counts as position one, so the main verb follows immediately: Weil es regnet, bleibe ich zu Hause. Adverbs like deshalb, trotzdem, dann take position one and force the subject after the verb. Inside the middle field the order is time, manner, place.",
  "slotGrammar": "Every noun has a gender (der, die, das) that must be learned with the word, together with its plural. There are four cases: nominative (subject), accusative (direct object, after für, durch, ohne, um, gegen), dative (indirect object, after mit, nach, aus, zu, von, bei, seit), genitive (possession, mostly written). Nine two-way prepositions (in, an, auf, über, unter, vor, hinter, neben, zwischen) take accusative for movement and dative for location: ich gehe ins Kino, ich bin im Kino. Adjectives before a noun take endings that depend on gender, case and the article in front of them. Pronouns change by case: ich, mich, mir; er, ihn, ihm.",
  "sound": "Long and short vowels are distinct and change meaning (Stadt vs Staat, bitten vs bieten); ü and ö need rounded lips. The letters ch have two sounds, the ich-Laut after front vowels and the Ach-Laut after a, o, u; sch is like English sh. Final b, d, g are devoiced (Tag sounds like tak), r is uvular at the start of a syllable and becomes a weak a-sound at the end (Mutter, der). Word stress falls on the first syllable of native words and on separable prefixes (ÁNrufen), never on inseparable prefixes (verSTÉHen). A glottal stop before vowel-initial words (ein | Apfel) keeps words from running together.",
  "register": "du (singular) and ihr (plural) are for family, friends, children, students and increasingly colleagues; Sie is for strangers, officials, shops and any adult who has not offered the du. The switch changes the verb (kannst du / können Sie), the possessive (dein / Ihr) and the imperative (Komm! / Kommen Sie!). Greetings shift too: Hallo and Tschüss with du, Guten Tag and Auf Wiedersehen with Sie."
 },
 "turnGrid": [
  {
   "time": "past",
   "aspect": "simple",
   "form": "ich bin gegangen / ich ging",
   "gloss": "I went",
   "note": "Spoken German uses the Perfekt (bin gegangen); ging is the written Präteritum."
  },
  {
   "time": "past",
   "aspect": "progressive",
   "form": "ich ging gerade / ich war gerade unterwegs",
   "gloss": "I was going",
   "note": "No progressive form: Präteritum or Perfekt plus gerade, or a rephrase such as unterwegs sein."
  },
  {
   "time": "past",
   "aspect": "perfect",
   "form": "ich war gegangen",
   "gloss": "I had gone",
   "note": "Plusquamperfekt: war/hatte + Partizip II. Used with nachdem, bevor and als to order two past events."
  },
  {
   "time": "present",
   "aspect": "simple",
   "form": "ich gehe",
   "gloss": "I go",
   "note": "The only present tense; it also covers 'I am going' and, with a time word, the future."
  },
  {
   "time": "present",
   "aspect": "progressive",
   "form": "ich gehe gerade",
   "gloss": "I am going (right now)",
   "note": "No -ing form; gerade or jetzt marks right now. 'Ich bin am Gehen' is colloquial and regional."
  },
  {
   "time": "present",
   "aspect": "perfect",
   "form": "ich bin gegangen",
   "gloss": "I have gone",
   "note": "The Perfekt is the everyday past, not an English present perfect. 'I have been here since May' is present: ich bin seit Mai hier."
  },
  {
   "time": "future",
   "aspect": "simple",
   "form": "ich gehe (morgen) / ich werde gehen",
   "gloss": "I will go",
   "note": "Present plus a time word is the default; werde gehen adds a promise, a prediction or formality."
  },
  {
   "time": "future",
   "aspect": "progressive",
   "form": "ich gehe dann gerade / ich werde dann gerade gehen",
   "gloss": "I will be going",
   "note": "Does not exist as a form; use the present or werden with gerade or dann."
  },
  {
   "time": "future",
   "aspect": "perfect",
   "form": "ich werde gegangen sein / bis dahin bin ich gegangen",
   "gloss": "I will have gone",
   "note": "Futur II exists but is rare in speech; usually the Perfekt plus bis dahin does the job."
  }
 ],
 "items": [
  {
   "id": "F-GREET",
   "target": "Hallo! / Guten Tag! ... Tschüss! / Auf Wiedersehen!",
   "gloss": "Hello / Good day ... Bye / Goodbye",
   "example": {
    "target": "Guten Morgen, Frau Weber! Wie geht es Ihnen? – Danke, gut. Und Ihnen?",
    "gloss": "Good morning, Ms Weber! How are you? – Fine, thanks. And you?"
   },
   "note": "C-HELLO-BYE plus Wie geht's? (du) or Wie geht es Ihnen? (Sie). In the south you will hear Grüß Gott and Servus.",
   "star": false
  },
  {
   "id": "F-INTRO",
   "target": "Ich heiße ___. Ich komme aus ___. Ich bin ___ von Beruf.",
   "gloss": "My name is ___. I come from ___. I am a ___ by profession.",
   "example": {
    "target": "Ich heiße Arjun, ich komme aus Indien und ich arbeite als Krankenpfleger.",
    "gloss": "I'm Arjun, I come from India and I work as a nurse."
   },
   "note": "C-MY-NAME, D-BE, G-FROM, G-AND. Jobs take no article: Ich bin Ingenieur, not ein Ingenieur.",
   "star": false
  },
  {
   "id": "F-THANK",
   "target": "Vielen Dank! / Danke schön! – Gern geschehen! / Bitte!",
   "gloss": "Many thanks! – You're welcome!",
   "example": {
    "target": "Vielen Dank für Ihre Hilfe! – Bitte, gern geschehen.",
    "gloss": "Many thanks for your help! – You're welcome."
   },
   "note": "C-PLEASE-THANKS. bitte answers danke as well as meaning please; für + accusative names what you are thanking for.",
   "star": false
  },
  {
   "id": "F-ASK-PRICE",
   "target": "Was kostet das? / Wie viel kostet ___?",
   "gloss": "What does that cost? / How much does ___ cost?",
   "example": {
    "target": "Entschuldigung, was kostet der Kaffee? – Drei Euro fünfzig.",
    "gloss": "Excuse me, what does the coffee cost? – Three euros fifty."
   },
   "note": "C-HOW-MUCH, T-WH. Prices are said as Euro plus number with no und: drei Euro fünfzig.",
   "star": false
  },
  {
   "id": "F-ASK-WAY",
   "target": "Wo ist ___? / Wie komme ich zu ___?",
   "gloss": "Where is ___? / How do I get to ___?",
   "example": {
    "target": "Entschuldigung, wie komme ich zum Bahnhof? – Immer geradeaus, dann links.",
    "gloss": "Excuse me, how do I get to the station? – Straight ahead, then left."
   },
   "note": "C-SORRY, C-WHERE-IS, T-WH. zu + dative: zum Bahnhof, zur Post. Listen for links, rechts, geradeaus, an der Ampel.",
   "star": false
  },
  {
   "id": "F-NOT-UNDERSTAND",
   "target": "Ich verstehe das nicht. / Können Sie das bitte wiederholen?",
   "gloss": "I don't understand that. / Can you please repeat that?",
   "example": {
    "target": "Entschuldigung, ich verstehe das nicht. Können Sie bitte langsamer sprechen?",
    "gloss": "Sorry, I don't understand. Could you please speak more slowly?"
   },
   "note": "C-DONT-UNDERSTAND, C-REPEAT-PLEASE, D-CAN. Add Wie bitte? for 'pardon?'; a bare Was? sounds rude.",
   "star": true
  },
  {
   "id": "F-LIKE",
   "target": "Ich mag ___. / Ich ___ gern. / Ich mag ___ nicht.",
   "gloss": "I like ___. / I like ___-ing. / I don't like ___.",
   "example": {
    "target": "Ich esse gern Pizza, aber ich mag keinen Fisch.",
    "gloss": "I like eating pizza, but I don't like fish."
   },
   "note": "D-LIKE, T-NEG, G-BUT. mögen for nouns, verb + gern for activities. Negate a noun with kein, an activity with nicht gern.",
   "star": false
  },
  {
   "id": "F-WANT",
   "target": "Ich möchte ___, bitte. / Ich hätte gern ___.",
   "gloss": "I would like ___, please. / I'd like ___.",
   "example": {
    "target": "Ich hätte gern einen Cappuccino und ein Käsebrötchen, bitte.",
    "gloss": "I'd like a cappuccino and a cheese roll, please."
   },
   "note": "D-WOULD-LIKE, G-AND, C-PLEASE-THANKS. What you order is accusative: einen Kaffee. Ich will sounds like a child demanding.",
   "star": false
  },
  {
   "id": "D-BE",
   "target": "ich bin ___ / du bist ___ / Sie sind ___",
   "gloss": "I am ___ / you are ___",
   "example": {
    "target": "Ich bin Ingenieur und ich bin 35 Jahre alt.",
    "gloss": "I'm an engineer and I'm 35 years old."
   },
   "note": "sein is irregular: bin, bist, ist, sind, seid, sind. Jobs and nationalities take no article: Ich bin Inder, not ein Inder.",
   "star": true
  },
  {
   "id": "D-HAVE",